{
  "id": "W1_series_closed",
  "title": "Closed series NO3- to NH3 (sanity world)",
  "difficulty": "easy",
  "reference": {
    "notes": "Sanity check; every method should recover this. Parameters illustrative."
  },
  "ground_truth": {
    "id": "w1_series",
    "description": "NO3- -> NO2- -> NH3, closed mass balance.",
    "motif": "series",
    "species": [
      {
        "id": "NO3",
        "label": "NO3-",
        "formula": "NO3-",
        "role": "reactant",
        "observable": true,
        "N_oxidation_state": 5
      },
      {
        "id": "NO2",
        "label": "NO2-",
        "formula": "NO2-",
        "role": "intermediate",
        "observable": true,
        "N_oxidation_state": 3
      },
      {
        "id": "NH3",
        "label": "NH3/NH4+ (lumped)",
        "formula": "NH3",
        "role": "product",
        "observable": true,
        "N_oxidation_state": -3
      }
    ],
    "reactions": [
      {
        "id": "R1",
        "reactants": [
          {
            "species": "NO3",
            "coeff": 1
          }
        ],
        "products": [
          {
            "species": "NO2",
            "coeff": 1
          }
        ],
        "electrons": 2,
        "rate_law": {
          "family": "mass_action",
          "params": {
            "k": {
              "value": 0.03,
              "unit": "min^-1",
              "bounds": [
                1e-06,
                10.0
              ],
              "source": "ILLUSTRATIVE"
            }
          }
        }
      },
      {
        "id": "R2",
        "reactants": [
          {
            "species": "NO2",
            "coeff": 1
          }
        ],
        "products": [
          {
            "species": "NH3",
            "coeff": 1
          }
        ],
        "electrons": 6,
        "rate_law": {
          "family": "mass_action",
          "params": {
            "k": {
              "value": 0.08,
              "unit": "min^-1",
              "bounds": [
                1e-06,
                10.0
              ],
              "source": "ILLUSTRATIVE"
            }
          }
        }
      }
    ]
  },
  "observation": {
    "observed_species": [
      "NO3",
      "NO2",
      "NH3"
    ],
    "sampling_times_min": [
      0,
      10,
      20,
      30,
      45,
      60,
      90,
      120,
      180
    ],
    "noise": {
      "relative_sigma": 0.05,
      "absolute_sigma_mM": 0.1,
      "outlier_prob": 0.0,
      "outlier_scale": 0.0
    }
  },
  "design_space": {
    "potential_V_vs_RHE": [
      -0.6
    ],
    "pH": [
      7.0
    ],
    "c0_mM_N": [
      100.0
    ]
  },
  "budget": {
    "max_experiments": 1,
    "points_per_experiment": 9
  },
  "scoring": {
    "metrics": [
      "exact_network_recovery",
      "reaction_f1",
      "parameter_rel_error",
      "heldout_nmsle",
      "identifiability_flag_accuracy"
    ],
    "pass_threshold_rmsle": 0.05
  }
}
