{
  "id": "W5_potential_dependent",
  "title": "Potential-dependent branching ratio",
  "difficulty": "medium",
  "reference": {
    "citation": "Polatides & Kyriacou 2005, J. Appl. Electrochem. 35:421-427",
    "notes": "Branching ratio R2/R3 shifts with E (alphas 0.131 vs 0.089 from Fig. 6; R3 is second order in nitrite so branching also depends on nitrite level). Single-potential data cannot separate alphas. Rate constants at -2.0 V vs Ag/AgCl (about -1.39 V vs RHE at assumed pH 7); only 4 potentials (-1.6 to -2.0 V) were measured."
  },
  "ground_truth": {
    "id": "w5_potential",
    "description": "Polatides scheme: NO3->NO2->NH3 plus second-order 2 NO2->N2 (SINK), each step with its own Tafel-like potential dependence.",
    "motif": "series_parallel",
    "species": [
      {
        "id": "NO3",
        "label": "NO3-",
        "formula": "NO3-",
        "role": "reactant",
        "observable": true,
        "N_oxidation_state": 5
      },
      {
        "id": "NO2",
        "label": "NO2-",
        "formula": "NO2-",
        "role": "intermediate",
        "observable": true,
        "N_oxidation_state": 3
      },
      {
        "id": "NH3",
        "label": "NH3/NH4+ (lumped)",
        "formula": "NH3",
        "role": "product",
        "observable": true,
        "N_oxidation_state": -3
      },
      {
        "id": "SINK",
        "label": "N2/N2O (not measured)",
        "formula": "N2",
        "role": "sink",
        "observable": false,
        "n_N_per_molecule": 2,
        "N_oxidation_state": 0
      }
    ],
    "reactions": [
      {
        "id": "R1",
        "reactants": [
          {
            "species": "NO3",
            "coeff": 1
          }
        ],
        "products": [
          {
            "species": "NO2",
            "coeff": 1
          }
        ],
        "electrons": 2,
        "rate_law": {
          "family": "mass_action",
          "params": {
            "k": {
              "value": 0.0294,
              "unit": "min^-1",
              "bounds": [
                1e-06,
                10.0
              ],
              "source": "Polatides & Kyriacou 2005, J. Appl. Electrochem. 35:421, Sn85Cu15, -2.0 V vs Ag/AgCl"
            }
          },
          "potential_dependence": {
            "alpha": {
              "value": 0.0,
              "unit": "1",
              "bounds": [
                0.0,
                2.0
              ],
              "source": "Polatides & Kyriacou 2005, J. Appl. Electrochem. 35:421, Sn85Cu15, -2.0 V vs Ag/AgCl; nitrate step diffusion limited at -1.7 to -2.0 V, alpha not reported, set to 0"
            },
            "E_ref_V": -1.39
          }
        }
      },
      {
        "id": "R2",
        "reactants": [
          {
            "species": "NO2",
            "coeff": 1
          }
        ],
        "products": [
          {
            "species": "NH3",
            "coeff": 1
          }
        ],
        "electrons": 6,
        "rate_law": {
          "family": "mass_action",
          "params": {
            "k": {
              "value": 0.01056,
              "unit": "min^-1",
              "bounds": [
                1e-06,
                10.0
              ],
              "source": "Polatides & Kyriacou 2005, J. Appl. Electrochem. 35:421, Sn85Cu15, -2.0 V vs Ag/AgCl"
            }
          },
          "potential_dependence": {
            "alpha": {
              "value": 0.131,
              "unit": "1",
              "bounds": [
                0.0,
                2.0
              ],
              "source": "Polatides & Kyriacou 2005, J. Appl. Electrochem. 35:421, Sn85Cu15, -2.0 V vs Ag/AgCl (apparent alpha from Fig. 6 slope; 4 points)"
            },
            "E_ref_V": -1.39
          }
        }
      },
      {
        "id": "R3",
        "reactants": [
          {
            "species": "NO2",
            "coeff": 2
          }
        ],
        "products": [
          {
            "species": "SINK",
            "coeff": 2
          }
        ],
        "electrons": 6,
        "rate_law": {
          "family": "mass_action",
          "params": {
            "k": {
              "value": 0.00046,
              "unit": "min^-1",
              "bounds": [
                1e-06,
                10.0
              ],
              "source": "Polatides & Kyriacou 2005, J. Appl. Electrochem. 35:421, Sn85Cu15, -2.0 V vs Ag/AgCl"
            }
          },
          "potential_dependence": {
            "alpha": {
              "value": 0.089,
              "unit": "1",
              "bounds": [
                0.0,
                2.0
              ],
              "source": "Polatides & Kyriacou 2005, J. Appl. Electrochem. 35:421, Sn85Cu15, -2.0 V vs Ag/AgCl (apparent alpha from Fig. 6 slope; 4 points)"
            },
            "E_ref_V": -1.39
          }
        }
      }
    ]
  },
  "observation": {
    "observed_species": [
      "NO3",
      "NO2",
      "NH3"
    ],
    "sampling_times_min": [
      0,
      10,
      20,
      40,
      60,
      90,
      120,
      180
    ],
    "noise": {
      "relative_sigma": 0.05,
      "absolute_sigma_mM": 0.1,
      "outlier_prob": 0.0,
      "outlier_scale": 0.0
    }
  },
  "design_space": {
    "potential_V_vs_RHE": [
      -1.79,
      -1.39
    ],
    "pH": [
      7.0
    ],
    "c0_mM_N": [
      50.0
    ],
    "initial_conditions": [
      {
        "potential_V_vs_RHE": -1.39,
        "pH": 7.0,
        "c0_mM_N": 50.0
      }
    ]
  },
  "budget": {
    "max_experiments": 5,
    "points_per_experiment": 8
  },
  "scoring": {
    "metrics": [
      "exact_network_recovery",
      "reaction_f1",
      "parameter_rel_error",
      "heldout_nmsle",
      "identifiability_flag_accuracy"
    ],
    "pass_threshold_rmsle": 0.05
  }
}
